Shot#,Narration Line,Visual Prompt,Style Notes
1,"Sunlight breaking through dense jungle canopy, mist rising from the forest floor.","Wide aerial over rainforest canopy at dawn, golden light spilling through mist","35mm anamorphic, slow dolly, golden hour"
2,"Forests breathe without fear, stretching toward horizons untouched by smoke.","Tracking shot under dense green canopy, sunbeams slicing through leaves","Soft focus foreground, drifting camera"
3,"Each drop of dew holds a world, each petal a memory of rain.","Macro shot of dew on petals, reflecting miniature worlds","Shallow depth, extreme macro"
4,"Herds move like rivers, unbroken and unbound.","Herds of antelope moving across a grass plain, dust rising",Low angle tracking with parallax
5,"The sky speaks in waves of cloud, slow as the turning of an age.",Time-lapse of clouds rolling across mountain ridges,"Wide aerial, time-lapse"
6,"Here, the streets have learned to dream in green.",Overgrown street lined with moss-covered cars,Cinematic slow pan
7,Rooms once filled with voices now hum with the language of leaves.,"Abandoned room, vines crawling through windows","Soft interior light, dust motes"
8,Birdsong carries higher than any steel spire.,Birds nesting atop a rusted tower,Telephoto zoom on motion
9,Time threads itself through what was once glass.,Glass building overtaken by flowering vines,Tilt-up revealing growth
10,Roots crown the towers of a kingdom long forgotten.,Skyscraper crowned with roots and trees,Drone pullback
11,"Eyes meet — not as predator and prey, but as kin.",Close-up of animal eyes locking with camera,"Extreme close-up, eye light"
12,Laughter swims in the bright shallows.,Dolphins leaping together in bright shallows,"High frame rate, slow motion"
13,"The sea writes in silver cursive, line by living line.",Overhead of kelp forest swaying with fish schools,Aerial drone under water
14,"Wind speaks across the meadow, and the grass leans in to listen.",Wide meadow with grass rippling under wind,"Long lens, rolling focus"
15,"A great heart blinks slowly, holding the silence between beats.",Elephant blinking slowly in golden light,"Warm side-light, minimal motion"
16,"Gold dust drifts from the wings of bees, each flight a prayer.",Macro shot of bee dusted with pollen,Slow macro pan
17,"Deer graze without hurry, letting sweetness fall to the earth.",Deer grazing in misty glade,"Soft dawn light, tripod stillness"
18,"Rivers run against the tide, bearing the old ones home.",Salmon leaping upriver against current,Telephoto tracking
19,No rows. No rules. Only the wild agreement of seeds.,Wildflowers in chaotic bloom,"Vibrant color grade, no symmetry"
20,The sky gathers its storms like a storyteller drawing breath.,Rolling storm clouds above hills,Timelapse storm build
21,Glass and vine share the same frame now.,Broken window half-covered in ivy,Depth layering
22,The swing’s slow arc remembers the weight of laughter.,Old playground swing moving in wind,Slow push-in
23,Highways lead nowhere but back to the roots.,"Highway overpass cracked, trees sprouting through",Drone down-tilt
24,"Names fade, painted over by moss.",Faded lettering on wall obscured by moss,Macro detail
25,"Bridges keep watch in the fog, loyal to ghosts.",Bridge over misted river,Wide static
26,"I stand where no one stands, looking over all that breathes.",High vantage over sprawling forest,Crane shot
27,"My hand grazes the living world, and it does not pull away.",Hand brushing leaves in dappled light,Close-up with shallow focus
28,Light spills across the crowns of trees like an unspoken blessing.,Sunlight pouring through treetops,Lens flare
29,"From here, the forest has no edge.",Endless forest stretching to horizon,Wide aerial sweep
30,"The wind turns the last page, and the story waits in the dark.","Page turning in an old book, fade to black",Close-up fade out
